[1] openapi-oas30-draft4.yaml:34:26 at #/paths/~1test/get/responses/200/content/application~1json/examples/exclusiveMinInvalid/value/age

Example value must conform to the schema: `age` property must be > 10.

32 |     name: test
33 |     requiredField: value
34 |     age: 10
   |          ^^
35 | exclusiveMaxInvalid:
36 |   summary: exclusiveMaximum boolean boundary

referenced from openapi-oas30-draft4.yaml:15:15 at #/paths/~1test/get/responses/200/content/application~1json 

Error was generated by the no-invalid-media-type-examples rule.


[2] openapi-oas30-draft4.yaml:40:28 at #/paths/~1test/get/responses/200/content/application~1json/examples/exclusiveMaxInvalid/value/score

Example value must conform to the schema: `score` property must be < 20.

38 |     name: test
39 |     requiredField: value
40 |     score: 20
   |            ^^
41 | maxBoundaryValid:
42 |   summary: maxItems boundary valid

referenced from openapi-oas30-draft4.yaml:15:15 at #/paths/~1test/get/responses/200/content/application~1json 

Error was generated by the no-invalid-media-type-examples rule.


[3] openapi-oas30-draft4.yaml:52:21 at #/paths/~1test/get/responses/200/content/application~1json/examples/additionalPropsInvalid/value/forbiddenField

Example value must conform to the schema: must NOT have additional properties `forbiddenField`.

50 |                     name: test
51 |                     requiredField: value
52 |                     forbiddenField: not allowed
   |                     ^^^^^^^^^^^^^^
53 | components:
54 |   schemas:

referenced from openapi-oas30-draft4.yaml:15:15 at #/paths/~1test/get/responses/200/content/application~1json 

Error was generated by the no-invalid-media-type-examples rule.


[1] openapi-oas32-2020.yaml:36:26 at #/paths/~1test/get/responses/200/content/application~1json/examples/exclusiveMinInvalid/value/age

Example value must conform to the schema: `age` property must be > 10.

34 |     name: test
35 |     requiredField: value
36 |     age: 10
   |          ^^
37 | exclusiveMaxInvalid:
38 |   summary: exclusiveMaximum numeric boundary

referenced from openapi-oas32-2020.yaml:15:15 at #/paths/~1test/get/responses/200/content/application~1json 

Error was generated by the no-invalid-media-type-examples rule.


[2] openapi-oas32-2020.yaml:42:28 at #/paths/~1test/get/responses/200/content/application~1json/examples/exclusiveMaxInvalid/value/score

Example value must conform to the schema: `score` property must be < 20.

40 |     name: test
41 |     requiredField: value
42 |     score: 20
   |            ^^
43 | unevaluatedPropsInvalid:
44 |   summary: unevaluatedProperties invalid

referenced from openapi-oas32-2020.yaml:15:15 at #/paths/~1test/get/responses/200/content/application~1json 

Error was generated by the no-invalid-media-type-examples rule.


[3] openapi-oas32-2020.yaml:40:21 at #/paths/~1test/get/responses/200/content/application~1json/examples/exclusiveMaxInvalid/value

Example value must conform to the schema: must have property age when property name is present.

38 |   summary: exclusiveMaximum numeric boundary
39 |   value:
40 |     name: test
   |     ^^^^^^^^^^
41 |     requiredField: value
   |     ^^^^^^^^^^^^^^^^^^^^
42 |     score: 20
   |     ^^^^^^^^^
43 | unevaluatedPropsInvalid:
44 |   summary: unevaluatedProperties invalid

referenced from openapi-oas32-2020.yaml:15:15 at #/paths/~1test/get/responses/200/content/application~1json 

Error was generated by the no-invalid-media-type-examples rule.


[4] openapi-oas32-2020.yaml:49:21 at #/paths/~1test/get/responses/200/content/application~1json/examples/unevaluatedPropsInvalid/value/forbiddenField

Example value must conform to the schema: must NOT have unevaluated properties `forbiddenField`.

47 |     requiredField: value
48 |     age: 25
49 |     forbiddenField: not allowed
   |     ^^^^^^^^^^^^^^
50 | prefixItemsInvalid:
51 |   summary: prefixItems invalid

referenced from openapi-oas32-2020.yaml:15:15 at #/paths/~1test/get/responses/200/content/application~1json 

Error was generated by the no-invalid-media-type-examples rule.


[5] openapi-oas32-2020.yaml:56:35 at #/paths/~1test/get/responses/200/content/application~1json/examples/prefixItemsInvalid/value/tags/1

Example value must conform to the schema: `1` property type must be string.

54 |     requiredField: value
55 |     age: 25
56 |     tags: [first, 123, third]
   |                   ^^^
57 | itemsRemainingInvalid:
58 |   summary: items false invalid

referenced from openapi-oas32-2020.yaml:15:15 at #/paths/~1test/get/responses/200/content/application~1json 

Error was generated by the no-invalid-media-type-examples rule.


[6] openapi-oas32-2020.yaml:63:33 at #/paths/~1test/get/responses/200/content/application~1json/examples/itemsRemainingInvalid/value/tagsStrict

Example value must conform to the schema: `tagsStrict` property must NOT have more than 2 items.

61 |                     requiredField: value
62 |                     age: 25
63 |                     tagsStrict: [first, second, third, fourth]
   |                                 ^^^^^^^^^^^^^^^^^^^^^^^^^^^^^^
64 |
65 | components:

referenced from openapi-oas32-2020.yaml:15:15 at #/paths/~1test/get/responses/200/content/application~1json 

Error was generated by the no-invalid-media-type-examples rule.



validating openapi-oas30-draft4.yaml using lint rules for api 'oas3.0'...
openapi-oas30-draft4.yaml: validated in <test>ms

validating openapi-oas32-2020.yaml using lint rules for api 'oas3.2'...
openapi-oas32-2020.yaml: validated in <test>ms

❌ Validation failed with 9 errors.
run `redocly lint --generate-ignore-file` to add all problems to the ignore file.

